id,deptCode,deptName,number,code,title,description,credits,active,rawPrerequisites,url
AFH 391,AFH,,391,AFH 391,Topics in Africana Studies,"May be repeated for credit as the topic changes. Designed for upper-division students, this course provides an in-depth study of a specific topic within humanities disciplines such as music, art, literature, religion, and philosophy. Students will be expected to demonstrate knowledge of the conventions and methods used in the humanities discipline(s) studied. Past topics have included titles such as Black Women Writers; Autobiography and Biography as Black History; and The African Novel: Origins and Development.",3,True,U3 or U4 standing,https://catalog.stonybrook.edu/preview_course_nopop.php?catoid=8&coid=8475
AFH 423,AFH,,423,AFH 423,Africana Literature in French,"An examination of a range of literature in French produced by writers throughout the African diaspora who claim affiliation with Africa. While the course is conducted in French, students will have the option to write papers in either French or English. Competence in reading and speaking French is a requirement for the course.",3,True,"FRN 395 , FRN 396 or Permission of the Instructor.",https://catalog.stonybrook.edu/preview_course_nopop.php?catoid=8&coid=8476
AFH 444,AFH,,444,AFH 444,Experiential Learning,"This course is designed for students who engage in a substantial, structured experiential learning activity in conjunction with another class. Experiential learning occurs when knowledge acquired through formal learning and past experience are applied to a “real-world” setting or problem to create new knowledge through a process of reflection, critical analysis, feedback and synthesis. Beyond-the-classroom experiences that support experiential learning may include: service learning, mentored research, field work, or an internship.",0,True,WRT 102 or equivalent; permission of the instructor and approval of the EXP contract ( http://sb.cc.stonybrook.edu/bulletin/current/policiesandregulations/degree_requirements/EXPplus.php ),https://catalog.stonybrook.edu/preview_course_nopop.php?catoid=8&coid=8477
AFH 447,AFH,,447,AFH 447,Readings in Africana Studies,Individually supervised reading in selected topics in the Black Experience.,1,True,Permission of instructor and program director,https://catalog.stonybrook.edu/preview_course_nopop.php?catoid=8&coid=8478
AFH 475,AFH,,475,AFH 475,Undergraduate Teaching Practicum I,"Work with a faculty member as an assistant in one of the faculty member’s regularly scheduled classes. The student is required to attend all the classes, do all the regularly assigned work, and meet with the faculty member at regularly scheduled times to discuss the intellectual and pedagogical matters relating to the course. Students may not serve as teaching assistants in the same course twice. Not for major or minor credit.",3,True,Africana studies major or minor; U4 standing; permission of instructor,https://catalog.stonybrook.edu/preview_course_nopop.php?catoid=8&coid=8479
AFH 476,AFH,,476,AFH 476,Undergraduate Teaching Practicum II,"Work with a faculty member as an assistant in one of the faculty member’s regularly scheduled classes. The student is required to attend all the classes, do all the regularly assigned work, and meet with the faculty member at regularly scheduled times to discuss the intellectual and pedagogical matters relating to the course. Students assume greater responsibility in such areas as leading discussions and analyzing results of tests that have already been graded. Students may not serve as teaching assistants in the same course twice. Not for major or minor credit.",3,True,AFS 475 ; permission of instructor,https://catalog.stonybrook.edu/preview_course_nopop.php?catoid=8&coid=8480
AFH 487,AFH,,487,AFH 487,Research in Africana Studies,Individual research projects in the Black Experience carried out under the direct supervision of a faculty member.,0,True,Permission of instructor and program director,https://catalog.stonybrook.edu/preview_course_nopop.php?catoid=8&coid=8481
AFS 101,AFS,,101,AFS 101,Themes in the Black Experience I,An historical survey of the experience of black people against the background of a thorough review of American history and the events which impacted upon the black experience in America. This course also examines the responses of African Americans to the changing historical circumstances that they encountered in the United States. Consideration is also given to the similarities and differences among the lifestyles of people of African descent in America. This course treats themes to 1865.,3,True,,https://catalog.stonybrook.edu/preview_course_nopop.php?catoid=8&coid=8482
AFS 102,AFS,,102,AFS 102,Themes in the Black Experience II,An historical survey of the experience of black people against the background of a thorough review of American history and the events which impacted upon the black experience in America. This course also examines the responses of African Americans to the changing historical circumstances that they encountered in the United States. Consideration is also given to the similarities and differences among the lifestyles of people of African descent in America. This course treats themes from 1865 to the present.,3,True,,https://catalog.stonybrook.edu/preview_course_nopop.php?catoid=8&coid=8483
AFS 221,AFS,,221,AFS 221,Introduction to Modern African History,Historical themes in 19th- and 20th-century Africa. Topics include social and political relations in African states; slavery and the slave trade in West Africa; the impact of Christianity and Islam on African colonialism; colonialism and its consequences; nationalist movements and de-colonization; pan-Africanism and the politics of African unity; the postcolonial state project; economic planning in postcolonial Africa; and African states and international politics in the Cold War era.,3,True,,https://catalog.stonybrook.edu/preview_course_nopop.php?catoid=8&coid=8484
AFS 223,AFS,,223,AFS 223,Regional History of Africa,"Given the immensity of the African continent, it is often divided into regions (such as east, west, north, or southern, equatorial, the Horn, the Sahel, Atlantic or Indian Ocean) to explore connections and boundaries. This course gives students the opportunity to focus more deeply on a region of Africa. The particular region examined will change each semester. Factors that integrate a region may be environment and land use strategies, long-distance trade networks, religious communities, imperialism, and political regimes. The course will examine the challenges to regional integration, such as conflicts, language diversity, and separatist movements.",3,True,,https://catalog.stonybrook.edu/preview_course_nopop.php?catoid=8&coid=8485
AFS 239,AFS,,239,AFS 239,Introduction to the Caribbean Experience,An introduction to the political economy of contemporary Caribbean societies with emphasis on the historical roots of their present underdevelopment.,3,True,,https://catalog.stonybrook.edu/preview_course_nopop.php?catoid=8&coid=8486
AFS 240,AFS,,240,AFS 240,Issues in Caribbean Society,"An analysis of the process of social change in the English, Spanish, and French Caribbean with special emphasis on those societies undergoing rapid transformation.",3,True,,https://catalog.stonybrook.edu/preview_course_nopop.php?catoid=8&coid=8487
