id,deptCode,deptName,number,code,title,description,credits,active,rawPrerequisites,url
ASC 101,ASC,,101,ASC 101,Practicing Engaging Presentations,"An introduction to the basics of public speaking, including how to engage audiences with relevant and engaging resources. Each week, students prepare and give presentations on various topics, and develop skills including using appropriate body language, effectively utilizing audio and visual aids, finding a personal presentation style, and handling the unexpected. Presentation formats addressed include introductory, instructional, and informational. Students receive feedback from instructors and peers, and are expected to build upon this feedback each week.",0,True,,https://catalog.stonybrook.edu/preview_course_nopop.php?catoid=8&coid=8806
ACC 210,ACC,,210,ACC 210,Financial Accounting,"This course presents an introduction to fundamental financial accounting principles, concentrating on identifying, recording, and communicating the economic events of a business organization. Topics include the accounting cycle, the preparation and presentation of the income statement, retained earnings statement and balance sheet, and an in-depth exploration of the measure and presentation of assets and liabilities.",3,True,Business Major or ACC Minor or MTD or ECO or ISE Major or FIN Minor,https://catalog.stonybrook.edu/preview_course_nopop.php?catoid=8&coid=8447
ACC 214,ACC,,214,ACC 214,Managerial Cost Analysis and Applications,"A study of cost concepts, and theories as it relates to cost accumulation systems for product, process and activity based costing, as well as the implementation and evaluation of an accounting system as a source of information for decision making, planning, control, and evaluation of the organization by management. Includes cost-volume-profit analysis, overhead rates, budgeting and variance analysis, statement of cash flows and financial statement ratio analysis.",3,True,BUS major or ACC minor or FIN minor or ISE major,https://catalog.stonybrook.edu/preview_course_nopop.php?catoid=8&coid=8448
ACC 301,ACC,,301,ACC 301,Governmental & Not-for-Profit Accounting and Reporting,"This course is designed to introduce the student to the accounting and financial reporting practices of governmental and not-for-profit entities. The course will explore standards issued by the Financial Accounting Standards Board (FASB) and the Governmental Accounting Standards Board (GASB). Students will also familiarize themselves with the various funds and groups of accounts applicable to governmental entities, as well as financial reporting for nonprofit organizations, including colleges, universities and hospitals.",3,True,ACC 210 ​,https://catalog.stonybrook.edu/preview_course_nopop.php?catoid=8&coid=22748
ACC 310,ACC,,310,ACC 310,Intermediate Accounting I,"This course expands upon the basic financial accounting framework and explores the theoretical and analytical applications of Generally Accepted Accounting Principles (GAAP) in a business environment. The student will gain an understanding of financial reporting criteria and the reliance placed upon financial information by external users. Topics include the measurement and reporting of cash, receivables, inventories, and operational assets, revenue recognition and the preparation of financial statements.",3,True,BUS major or ACC minor and ACC 210,https://catalog.stonybrook.edu/preview_course_nopop.php?catoid=8&coid=8449
ACC 311,ACC,,311,ACC 311,Federal Income Taxation I,"Introduces and explores fundamental income taxation concepts for individuals. Topics include gross income, exclusions, adjusted gross income, deductions, exemptions, tax computations, and credits. Introductory tax concepts, including cash and accrual methods, property acquisitions and dispositions, like-kind exchanges, and passive loss rules are also reviewed. Additionally, students will familiarize themselves with tax planning concepts, the legislative process, and professional responsibilities in tax practice.",3,True,BUS major or ACC minor,https://catalog.stonybrook.edu/preview_course_nopop.php?catoid=8&coid=8450
ACC 313,ACC,,313,ACC 313,Intermediate Accounting II,"This course is the second in the intermediate accounting sequence ( ACC 310 ). This course continues in the exploration of the financial accounting framework and the theoretical and analytical applications of Generally Accepted Accounting Principles (GAAP). Topics the study of advanced topics including accounting for investments, stockholders equity, pensions, leases, income taxes, bonds, and other contemporary financial accounting issues.",3,True,BUS major or ACC Minor and ACC 310,https://catalog.stonybrook.edu/preview_course_nopop.php?catoid=8&coid=8451
ACC 314,ACC,,314,ACC 314,Federal Income Taxation II,"Introduces and explores fundamental income taxation concepts for business entities, with a focus on C corporations, S corporations, and partnerships. Topics include the formation, operation, reorganization and liquidation of C corporations, as well as the formation, operation and liquidation of flow-through entities. Students will also familiarize themselves with specialty topics concerning estates and trusts, transfer taxes and jurisdictional taxation.",3,True,BUS Major or ACC Minor and ACC 311,https://catalog.stonybrook.edu/preview_course_nopop.php?catoid=8&coid=8452
ACC 320,ACC,,320,ACC 320,Artificial Intelligence in Accounting and Assurance,"This course introduces the concepts and applications of AI in modern organizations from the perspective of accounting and auditing. In this context, AI broadly refers to the technologies employed in enterprise accounting, including Machine Learning (ML), Natural Language Processing (NLP), and Robotic Process Automation (RPA). To illustrate the underlying principles and implementations of AI in accounting and auditing, this course also introduces AI tools and demonstrates its applications to analyzing real-world data. Students gain hands-on experience with AI software for accounting and auditing.",3,True,BUS major or ACC minor and ACC 210,https://catalog.stonybrook.edu/preview_course_nopop.php?catoid=8&coid=22747
ACC 400,ACC,,400,ACC 400,External Auditing,"The course is designed to introduce and explore basic auditing principles, concepts and applications within the context of the audit of an annual financial statement. This course will review the audit process and cover the following: planning (identification of the risks of material misstatement); application of procedures (reducing audit risk below an acceptable level); assessment (based upon documented audit evidence); and, reporting (in accordance with generally accepted auditing standards) This course will also examine professional ethical standards and their relevance to the audit process. Other topics will include analysis and testing of internal control, substantive testing, and accounting research.",3,True,BUS Major or ACC minor and ACC 210,https://catalog.stonybrook.edu/preview_course_nopop.php?catoid=8&coid=8453
ACC 401,ACC,,401,ACC 401,Intermediate Managerial Accounting & Data Analytics,"The course is designed to build upon the principles and concepts in an introductory managerial accounting course with a focus on applied skills. This course will review business planning, performance evaluation, cost flows, setting and achieving targets in a customer domain, and strategic cost management. This course will also examine the ethics associated with managing a large and complex organization. Lastly, this course will provide an overview of data analytics as it pertains to managerial accounting, auditing, and taxation.",3,True,Business major; BUS 215 ; ACC 214 ; and ACC 313,https://catalog.stonybrook.edu/preview_course_nopop.php?catoid=8&coid=22749
ACC 402,ACC,,402,ACC 402,Advanced Accounting,"This course provides students with in-depth and up-to-date coverage of accounting for investments, business combinations, consolidated financial statements, segment and interim reporting, foreign currency transactions, and partnerships. The course links theory and practice with consistent emphasis on the logic of procedures.",3,True,ACC 313,https://catalog.stonybrook.edu/preview_course_nopop.php?catoid=8&coid=11666
AIM 100,AIM,,100,AIM 100,EOP Pre-Freshman Summer Academic Bridge,"The purpose of the EOP Summer Academic Bridge course is to give students a foundation in math, writing, and a science related to their undergraduate goals. The course will build on their current skills with the goal of increasing the likelihood of their academic success in these areas during their first full semester at Stony Brook University. Students will be placed in the appropriate section based on the university placement recommendations in math and writing. The EOP Summer Academic Bridge will be supported through the EOP Transitional Support Bridge course.",3,True,,https://catalog.stonybrook.edu/preview_course_nopop.php?catoid=8&coid=8534
AIM 101,AIM,,101,AIM 101,EOP Pre-Freshman Summer Support Bridge,"The purpose of the EOP Summer Bridge course is to build a strong, supportive foundation by introducing the necessary support and resources needed to be successful at Stony Brook University. The course will build on their current skills with the goal of increasing the likelihood of the student’s success in acclimating to college and Stony Brook University culture and lifestyle. Additionally, the course goal is to help students navigate the challenges that stem from socioeconomic disadvantage. In addition, this course will support the EOP Academic Bridge course.",3,True,,https://catalog.stonybrook.edu/preview_course_nopop.php?catoid=8&coid=8535
AIM 102,AIM,,102,AIM 102,Expository Writing,The fundamentals of grammar through investigating methods of interpreting various forms of literature with emphasis on the process of writing and re-writing. Does not count toward graduation. A through C/Unsatisfactory grading only. The Pass/No credit option may not be used. Open to EOP/AIM students only.,3,True,Placement by writing placement examination,https://catalog.stonybrook.edu/preview_course_nopop.php?catoid=8&coid=8536
AIM 104,AIM,,104,AIM 104,Literary Analysis and Critical Reasoning,Introduction to literary analysis and critical reasoning through close examination of selected works. Open to EOP/AIM students only. A through C/Unsatisfactory grading only. The Pass/No credit option may not be used.,3,True,Placement by writing placement examination,https://catalog.stonybrook.edu/preview_course_nopop.php?catoid=8&coid=8537
ADV 101,ADV,,101,ADV 101,Advising 101 Transfer Seminar,"A seminar intended to integrate transfer students into the University community by sharing information about Stony Brook and creating a forum to develop intellectual, social, writing, and communication skills. The course emphasizes institutional expectations to promote student success. Recommended for first semester transfer students entering with less than 57 earned credits. Required for all first semester international transfer students. Not for credit in addition to ACH 101, GLS 101, HDV 101, ITS 101, LDS 101, LSE 101, SBU 101 , SCH 101 , or SSO 101.",1,True,New transfer student,https://catalog.stonybrook.edu/preview_course_nopop.php?catoid=8&coid=8454
ADV 201,ADV,,201,ADV 201,Preparing for Medical School,"This course provides a broad survey of pre-medical studies, preparation for medical school admission, and the medical profession. The course will review medical school admission requirements and procedures, the academic coursework at both the undergraduate and professional school levels, the residency training of the physician, the typical routines of a medical practice, and other issues affecting the training of a medical doctor in the United States. In addition, the class will provide students opportunities for continual self-evaluation of personal motivations to enter the health profession. The course follows the chronological sequence taken by the traditional student to become a licensed medical doctor, and examines how this sequence of events plays an integral role in the development of a capable physician.",1,True,U2 or higher standing. Completion of at least one pre-medical science sequence and permission of the instructor.,https://catalog.stonybrook.edu/preview_course_nopop.php?catoid=8&coid=8455
ADV 202,ADV,,202,ADV 202,Academic Success Seminar,"Designed to help students develop essential skills needed to become lifelong, self-regulated and self-motivated learners. Through guided journals and assignments, students will use self-reflection to identify possible self sabotaging thoughts and behaviors and discover what may be getting in the way of their academic and personal success. Students will discover how they learn and develop and strengthen their study skills. Topics to be covered include motivation, how memory works, metacognition, critical thinking, decision making, attention and concentration, goal setting, time management and other study skills strategies.",2,True,Permission of instructor,https://catalog.stonybrook.edu/preview_course_nopop.php?catoid=8&coid=8456
ADV 475,ADV,,475,ADV 475,Undergraduate Teaching Practicum I,"Work as an assistant with an instructor of an ADV 101 regularly scheduled class or with the coordinator/instructor of ADV 488 . The student is required to attend all classes, keep current with the regularly assigned work, and meet with the instructor at regularly scheduled times to discuss the intellectual and pedagogical matters relating to the course.",0,True,U3 or U4 standing; permission of ADV 101 or ADV 488 coordinator and director of the Academic & Transfer Advising Services Center; completion of ADV 101 or ADV 488 or equivalent experience,https://catalog.stonybrook.edu/preview_course_nopop.php?catoid=8&coid=8457
ADV 476,ADV,,476,ADV 476,Undergraduate Teaching Practicum II,"Work as an assistant with an instructor of an ADV 101 regularly scheduled class or with the coordinator/instructor of ADV 488 . The student is required to attend all classes, keep current with the regularly assigned work, and meet with the instructor at regularly scheduled times to discuss the intellectual and pedagogical matters relating to the course. The student assumes greater responsibility in such areas as leading discussions and researching class-appropriate topics.",0,True,ADV 475 ; permission of ADV 101 or ADV 488 coordinator and director of the Academic & Transfer Advising Services Center,https://catalog.stonybrook.edu/preview_course_nopop.php?catoid=8&coid=8458
ADV 488,ADV,,488,ADV 488,Academic and Transfer Advising Services Internship,"This two semester internship offers outstanding juniors and seniors an opportunity to gain advising experience, improve personal and professional skills, and explore career aspirations while providing assistance to others. Responsibilities include a teaching assistantship for a first semester transfer student seminar, provide support to undergraduates on making the academic and personal transition to Stony Brook, conducting oral presentations with other Academic Peer Advisors to students, and serving as a role model and mentor for other Stony Brook undergraduates. Interns are required to attend a weekly Academic Peer Advisor seminar, complete a set number of outreach hours, assist with events across campus and work in the Advising and Transfer Advising Services Center. Repeatable to a maximum of 12 credits.",3,True,Students are selected for the course based on an application which may be obtained from the advising office. Students must have earned 45 credits and a 3.0 cumulative GPA by the application date.,https://catalog.stonybrook.edu/preview_course_nopop.php?catoid=8&coid=8459
AFH 101,AFH,,101,AFH 101,The Wonders of the Black World,"This class is an introductory, general education, diversity class in which students are introduced to global issues that directly impact their lives. Starting with the construction of Blackness in the United States at the intersection between historical memories and American indigenous knowledge, the class analyzes what it means to be Back today: in the United States first, using the students own environment and histories, and then across the general landscape of Global Blackness. The goal is to lay the background for an appreciation of the Black world in its diverse manifestations from Africa to the Americas (Latin America, United States, Canada, the Caribbean), from Asia (India, the Middle East) to Europe (Spain, France, England, etc.).",3,True,,https://catalog.stonybrook.edu/preview_course_nopop.php?catoid=8&coid=8460
AFH 205,AFH,,205,AFH 205,Contemporary African Literature,"Contemporary African Literature is an introductory course on fictional and nonfictional works by canonized African writers from the African continent and the diaspora. Close readings of literature by authors from the 1950s to the present day, such as Chinua Achebe, Ngugi Wa Thiong’o, and Chimamanda Adichie unveil literary traditions, themes, and motifs specific to African writing. An examination of the writers’ attention to topics such as (colonialism, ethnic war, gender oppression, migration, and Afropolitanism) allows for a critical analysis of the historical, social, and political issues on the African continent. The authors’ discussions about globalization and its impact on African nations, particularly in relationship to the global marketplace, highlight the paradoxical nature of Africa’s rich natural resources (oil, diamonds and coltan) against the continent’s economic dependency on global investors. Postcolonialism, Feminism, and Psychoanalytic theory will enrich students’ interpretation and analysis of the texts.",3,True,,https://catalog.stonybrook.edu/preview_course_nopop.php?catoid=8&coid=8461
AFH 206,AFH,,206,AFH 206,Great Books of the Black Experience,"An exploration of some of the key writings from autobiographies to novels, etc., important to becoming familiar with central lines of thought and interpretation in the larger Black Experience. Focus and readings vary depending on each semester’s emphasis.",3,True,,https://catalog.stonybrook.edu/preview_course_nopop.php?catoid=8&coid=8462
AFH 215,AFH,,215,AFH 215,Hip Hop and the Intellectual Tradition,"Examines the world of hip-hop, by framing it within the fields of intellectual theory and examining the scholarly and artistic contributions of rap artists, writers, and scholars who intellectualize the global and cultural phenomenon of Hip Hop. This course will attempt to complicate the largely historical and non-theoretical treatment of hip hop in mass-mediated portrayals by engaging in a cultural studies critique of youth cultural formations and the rapid global industrialization of hip-hop. The course will also highlight how contemporary issues concerning racial and gender politics, sexual orientation, globalization, and neocolonialism are tackled by the music and culture.",3,True,,https://catalog.stonybrook.edu/preview_course_nopop.php?catoid=8&coid=8463
AFH 249,AFH,,249,AFH 249,African-American Literature and Music in the 19th and 20th Centuries,"A detailed look at African-American literature and music and their importance for American literature and music of the 19th and 20th centuries. An examination of the literature with attention to the special stylistic devices, tones of literary voice, and characterization that writers use in their efforts to match the music experience with the written word. Selections from the recordings of African-American and African-American inspired musicians – from Bessie Smith and Louis Armstrong to Jimi Henrix and the Rolling Stones.This course is offered as both AFH 249 and EGL 249 .",3,True,,https://catalog.stonybrook.edu/preview_course_nopop.php?catoid=8&coid=8464
AFH 282,AFH,,282,AFH 282,Contemporary Caribbean Women’s Literature,"Examines the political, social, and historical experiences of women from anglophone francophone, and hispanophone Caribbean nations. The readings, movies, and projects selected for the course highlight reccurent themes in Caribbean literature such as exile, migration, identity, colorism, slavery, sexual oppression, transnational motherhood, and identity politics. Feminist criticism, Postcolonialsm, and critical race theory will be applied to our reading of the texts.",3,True,,https://catalog.stonybrook.edu/preview_course_nopop.php?catoid=8&coid=8465
AFH 329,AFH,,329,AFH 329,Pan-African Literature I,"An examination of the cultural themes of Pan-Africanism and negritude, drawing on a selection of writers from the United States, Africa, and the Caribbean. The course treats the development, diffusion, and significance of these themes. It involves intensive consideration of selected literary works of African and African-American expression.",3,True,U3 or U4 standing,https://catalog.stonybrook.edu/preview_course_nopop.php?catoid=8&coid=8466
AFH 330,AFH,,330,AFH 330,Pan-African Literature II,"An examination of the cultural themes of Pan-Africanism and negritude, drawing on a selection of writers from the United States, Africa, and the Caribbean. The course treats the development, diffusion, and significance of these themes. It involves intensive consideration of selected literary works of African and African-American expression.",3,True,U3 or U4 standing,https://catalog.stonybrook.edu/preview_course_nopop.php?catoid=8&coid=8467
AFH 339,AFH,,339,AFH 339,Arts of the African Diaspora,"A study of the arts of the African Diaspora from the African continent to Brazil, Surinam, the Caribbean, and the United States. Emphasis is on the full range of art forms, including not only sculptural and performance traditions, but also textiles, basketry, and other crafts. Cultural continuities, spiritual belief, and significant changes in context, meaning, style, and technology are examined.",3,True,U3 or U4 standing,https://catalog.stonybrook.edu/preview_course_nopop.php?catoid=8&coid=8468
AFH 368,AFH,,368,AFH 368,Caribbean and American Connections in Literature,"An exploration of the connections between writers from the French-speaking and English-speaking Caribbean and from the African-American community, who share a similar cultural heritage, historical heritage, and historical experience, but differ in geopolitical situations. Special attention is paid to spirituality, gender, and identity motifs in the literature. Covers the Interdisciplinary topic for the English major.",3,True,U3 or U4 standing,https://catalog.stonybrook.edu/preview_course_nopop.php?catoid=8&coid=8469
AFH 379,AFH,,379,AFH 379,Philosophy of Race (III),"Examination of our assumptions about race and the impact of those assumptions on issues concerning gender, class, and sexuality throughout American history. Readings include critical race theory, feminist theory, and critical legal theory. Students examine racial issues from a philosophical perspective and consider the ways in which representations of race may reinforce patterns of power and privilege.",3,True,one PHI course,https://catalog.stonybrook.edu/preview_course_nopop.php?catoid=8&coid=8470
AFH 380,AFH,,380,AFH 380,African American and Caribbean Theatre,"African American and Caribbean Theatre examines the connection between Black theatre and political and social movements of the 1940s to the 2000s. The course studies how playwrights use theatre to educate audiences about specific injustices of the day. An historical reading of the plays by playwrights such as Wole Soyinka, August Wilson, Lorraine Hansberry, and Susan Lori Parks introduces students to major topics for discussion in black theatre, including racial politics, socio-political disenfranchisement, the struggle to define self, and alienation from the community/society.",3,True,U3 or U4 standing,https://catalog.stonybrook.edu/preview_course_nopop.php?catoid=8&coid=8471
AFH 382,AFH,,382,AFH 382,Black Women’s Literature of the African Diaspora,"Black women’s literature presents students with the opportunity to examine through literature the political, social, and historical experiences of Black women from the African Diaspora. The course is structured around five major themes commonly addressed in Black women’s writing: Black female oppression, sexual politics of Black womanhood, Black female sexuality, Black male/female relationships, and Black women and defining self. Covers the Interdisciplinary topic for the English major.",3,True,U3 or U4 standing,https://catalog.stonybrook.edu/preview_course_nopop.php?catoid=8&coid=8472
AFH 385,AFH,,385,AFH 385,French Caribbean Literature,"A study of representative texts from the French Caribbean translated into English, focusing on literary manifestations of a search for a specific identity by writers from Martinique, Guadeloupe, French Guiana, and Haiti.",3,True,Junior or Senior Standing,https://catalog.stonybrook.edu/preview_course_nopop.php?catoid=8&coid=8473
AFH 390,AFH,,390,AFH 390,Topics in Africana Studies,"May be repeated for credit as the topic changes. Designed for upper-division students, this course provides an in-depth study of a specific topic within humanities disciplines such as music, art, literature, religion, and philosophy. Students will be expected to demonstrate knowledge of the conventions and methods used in the humanities discipline(s) studied. Past topics have included titles such as Black Women Writers; Autobiography and Biography as Black History; and The African Novel: Origins and Development.",3,True,U3 or U4 standing,https://catalog.stonybrook.edu/preview_course_nopop.php?catoid=8&coid=8474
